{
  "format": "lupine-level-v2",
  "name": "Twin Sentinel acceptance chamber",
  "width": 16,
  "height": 16,
  "rows": [
    "1111111111111111",
    "1111111111111111",
    "1000011111111111",
    "1000011111111111",
    "1001011111111111",
    "1000011222222111",
    "1113111200002111",
    "1110000301002111",
    "1110111200002111",
    "1110011200002111",
    "1110011200002111",
    "1111311223222111",
    "1100001100001111",
    "1100001101001111",
    "1100001100001111",
    "1111111111111111"
  ],
  "player_spawn": {
    "x_q8": 1152,
    "y_q8": 3456,
    "angle": 192,
    "safe_radius_cells": 5
  },
  "doors": [
    {
      "id": "start_airlock",
      "x": 4,
      "y": 11,
      "orientation": "horizontal",
      "kind": "standard",
      "unlock": "none"
    },
    {
      "id": "service_branch",
      "x": 3,
      "y": 6,
      "orientation": "horizontal",
      "kind": "standard",
      "unlock": "none"
    },
    {
      "id": "zigzag_entry",
      "x": 7,
      "y": 7,
      "orientation": "vertical",
      "kind": "standard",
      "unlock": "none"
    },
    {
      "id": "exit_lock",
      "x": 9,
      "y": 11,
      "orientation": "horizontal",
      "kind": "exit",
      "unlock": "sentinel_dead"
    }
  ],
  "entities": [
    {
      "kind": "sentinel",
      "x_q8": 2688,
      "y_q8": 2176,
      "health": 3,
      "activation_radius_q4": 96
    },
    {
      "kind": "sentinel",
      "x_q8": 2432,
      "y_q8": 2176,
      "health": 3,
      "activation_radius_q4": 96
    }
  ],
  "pickups": [
    {
      "kind": "medkit",
      "source": "sentinel_drop",
      "value": 25
    }
  ],
  "triggers": [
    {
      "kind": "activate_exit",
      "condition": "sentinel_dead"
    }
  ],
  "exit": {
    "x": 10,
    "y": 13,
    "marker": "beacon"
  },
  "readability": {
    "maximum_sightline": 6,
    "minimum_door_separation": 8,
    "minimum_critical_path_steps": 15,
    "minimum_critical_path_turns": 3,
    "maximum_material_singletons": 16
  },
  "palette_profile": "outpost",
  "vram_profile": "entity-heavy",
  "fixtures": [
    {
      "x": 4,
      "y": 11,
      "side": "south",
      "kind": "access"
    },
    {
      "x": 3,
      "y": 6,
      "side": "south",
      "kind": "access"
    },
    {
      "x": 7,
      "y": 7,
      "side": "west",
      "kind": "access"
    },
    {
      "x": 9,
      "y": 11,
      "side": "north",
      "kind": "access"
    },
    {
      "x": 3,
      "y": 11,
      "side": "south",
      "kind": "light"
    },
    {
      "x": 5,
      "y": 11,
      "side": "south",
      "kind": "vent"
    },
    {
      "x": 1,
      "y": 13,
      "side": "east",
      "kind": "sector"
    },
    {
      "x": 6,
      "y": 13,
      "side": "west",
      "kind": "vent"
    },
    {
      "x": 4,
      "y": 8,
      "side": "west",
      "kind": "light"
    },
    {
      "x": 5,
      "y": 6,
      "side": "south",
      "kind": "sector"
    },
    {
      "x": 7,
      "y": 8,
      "side": "east",
      "kind": "vent"
    },
    {
      "x": 12,
      "y": 8,
      "side": "west",
      "kind": "light"
    },
    {
      "x": 10,
      "y": 5,
      "side": "south",
      "kind": "vent"
    },
    {
      "x": 9,
      "y": 7,
      "side": "south",
      "kind": "sector"
    },
    {
      "x": 12,
      "y": 13,
      "side": "west",
      "kind": "light"
    },
    {
      "x": 0,
      "y": 3,
      "side": "east",
      "kind": "vent"
    }
  ]
}
