{
  "format": "lupine-level-v2",
  "name": "Coolant Intake",
  "width": 16,
  "height": 16,
  "rows": [
    "1111111111111111",
    "1000010000100001",
    "1002000000100001",
    "1020010020300001",
    "1000010020100201",
    "1131111111111111",
    "1000010000100001",
    "1000000200100001",
    "1000010020300001",
    "1020010020102001",
    "1111111311111011",
    "1000010000100001",
    "1000010100100201",
    "1002000000100001",
    "1020010020100001",
    "1111111111111111"
  ],
  "player_spawn": {
    "x_q8": 640,
    "y_q8": 3456,
    "angle": 0,
    "safe_radius_cells": 5
  },
  "doors": [
    {
      "id": "pump_stair",
      "x": 7,
      "y": 10,
      "orientation": "horizontal",
      "kind": "standard",
      "unlock": "none"
    },
    {
      "id": "cistern_hatch",
      "x": 2,
      "y": 5,
      "orientation": "horizontal",
      "kind": "standard",
      "unlock": "none"
    },
    {
      "id": "intake_valve",
      "x": 10,
      "y": 8,
      "orientation": "vertical",
      "kind": "standard",
      "unlock": "none"
    },
    {
      "id": "core_lock",
      "x": 10,
      "y": 3,
      "orientation": "vertical",
      "kind": "exit",
      "unlock": "sentinel_dead"
    }
  ],
  "entities": [
    {
      "kind": "sentinel",
      "x_q8": 1152,
      "y_q8": 384,
      "health": 3,
      "activation_radius_q4": 96
    },
    {
      "kind": "warden",
      "x_q8": 640,
      "y_q8": 1920,
      "health": 5,
      "activation_radius_q4": 96
    },
    {
      "kind": "skirmisher",
      "x_q8": 2176,
      "y_q8": 1920,
      "health": 2,
      "activation_radius_q4": 96
    },
    {
      "kind": "skirmisher",
      "x_q8": 3456,
      "y_q8": 2176,
      "health": 2,
      "activation_radius_q4": 96
    },
    {
      "kind": "sentinel",
      "x_q8": 2176,
      "y_q8": 3200,
      "health": 3,
      "activation_radius_q4": 96
    }
  ],
  "pickups": [
    {
      "kind": "medkit",
      "source": "sentinel_drop",
      "value": 25
    }
  ],
  "triggers": [
    {
      "kind": "activate_exit",
      "condition": "sentinel_dead"
    }
  ],
  "exit": {
    "x": 13,
    "y": 2,
    "marker": "beacon"
  },
  "readability": {
    "maximum_sightline": 6,
    "minimum_door_separation": 8,
    "minimum_critical_path_steps": 15,
    "minimum_critical_path_turns": 3,
    "maximum_material_singletons": 16
  },
  "fixtures": [
    {
      "x": 7,
      "y": 10,
      "side": "north",
      "kind": "access"
    },
    {
      "x": 2,
      "y": 5,
      "side": "north",
      "kind": "access"
    },
    {
      "x": 10,
      "y": 8,
      "side": "west",
      "kind": "access"
    },
    {
      "x": 10,
      "y": 3,
      "side": "west",
      "kind": "access"
    },
    {
      "x": 5,
      "y": 1,
      "side": "west",
      "kind": "light"
    },
    {
      "x": 10,
      "y": 1,
      "side": "west",
      "kind": "vent"
    },
    {
      "x": 2,
      "y": 3,
      "side": "west",
      "kind": "sector"
    },
    {
      "x": 8,
      "y": 3,
      "side": "west",
      "kind": "light"
    },
    {
      "x": 13,
      "y": 4,
      "side": "west",
      "kind": "vent"
    },
    {
      "x": 4,
      "y": 5,
      "side": "north",
      "kind": "light"
    },
    {
      "x": 10,
      "y": 6,
      "side": "west",
      "kind": "light"
    },
    {
      "x": 7,
      "y": 7,
      "side": "west",
      "kind": "vent"
    },
    {
      "x": 2,
      "y": 9,
      "side": "west",
      "kind": "sector"
    },
    {
      "x": 12,
      "y": 9,
      "side": "west",
      "kind": "light"
    }
  ],
  "palette_profile": "reactor",
  "vram_profile": "entity-heavy"
}
