{
  "format": "lupine-level-v2",
  "name": "Pump Gallery",
  "width": 16,
  "height": 16,
  "rows": [
    "1111111111111111",
    "1110011000100001",
    "1110011000302021",
    "1000011020100001",
    "1000011000100001",
    "1131111101111111",
    "1000000201100001",
    "1000010000302001",
    "1002010021100101",
    "1020010001100101",
    "1111111311111101",
    "1000011000100001",
    "1002000020100021",
    "1000011200111001",
    "1111111000111001",
    "1111111111111111"
  ],
  "player_spawn": {
    "x_q8": 640,
    "y_q8": 3200,
    "angle": 0,
    "safe_radius_cells": 5
  },
  "doors": [
    {
      "id": "gallery_stair",
      "x": 7,
      "y": 10,
      "orientation": "horizontal",
      "kind": "standard",
      "unlock": "none"
    },
    {
      "id": "pump_hatch",
      "x": 10,
      "y": 7,
      "orientation": "vertical",
      "kind": "standard",
      "unlock": "none"
    },
    {
      "id": "valve_room",
      "x": 2,
      "y": 5,
      "orientation": "horizontal",
      "kind": "standard",
      "unlock": "none"
    },
    {
      "id": "gallery_lock",
      "x": 10,
      "y": 2,
      "orientation": "vertical",
      "kind": "exit",
      "unlock": "sentinel_dead"
    }
  ],
  "entities": [
    {
      "kind": "warden",
      "x_q8": 896,
      "y_q8": 640,
      "health": 5,
      "activation_radius_q4": 96
    },
    {
      "kind": "skirmisher",
      "x_q8": 2176,
      "y_q8": 1920,
      "health": 2,
      "activation_radius_q4": 96
    },
    {
      "kind": "sentinel",
      "x_q8": 3456,
      "y_q8": 1920,
      "health": 3,
      "activation_radius_q4": 96
    },
    {
      "kind": "sentinel",
      "x_q8": 3456,
      "y_q8": 3456,
      "health": 3,
      "activation_radius_q4": 96
    },
    {
      "kind": "skirmisher",
      "x_q8": 640,
      "y_q8": 1920,
      "health": 2,
      "activation_radius_q4": 96
    }
  ],
  "pickups": [
    {
      "kind": "medkit",
      "source": "sentinel_drop",
      "value": 25
    }
  ],
  "triggers": [
    {
      "kind": "activate_exit",
      "condition": "sentinel_dead"
    }
  ],
  "exit": {
    "x": 13,
    "y": 2,
    "marker": "beacon"
  },
  "readability": {
    "maximum_sightline": 6,
    "minimum_door_separation": 8,
    "minimum_critical_path_steps": 15,
    "minimum_critical_path_turns": 3,
    "maximum_material_singletons": 16
  },
  "fixtures": [
    {
      "x": 7,
      "y": 10,
      "side": "north",
      "kind": "access"
    },
    {
      "x": 10,
      "y": 7,
      "side": "west",
      "kind": "access"
    },
    {
      "x": 2,
      "y": 5,
      "side": "north",
      "kind": "access"
    },
    {
      "x": 10,
      "y": 2,
      "side": "west",
      "kind": "access"
    },
    {
      "x": 2,
      "y": 1,
      "side": "east",
      "kind": "light"
    },
    {
      "x": 6,
      "y": 1,
      "side": "east",
      "kind": "vent"
    },
    {
      "x": 10,
      "y": 1,
      "side": "west",
      "kind": "sector"
    },
    {
      "x": 14,
      "y": 2,
      "side": "west",
      "kind": "light"
    },
    {
      "x": 8,
      "y": 3,
      "side": "west",
      "kind": "vent"
    },
    {
      "x": 5,
      "y": 4,
      "side": "west",
      "kind": "light"
    },
    {
      "x": 1,
      "y": 5,
      "side": "north",
      "kind": "light"
    },
    {
      "x": 11,
      "y": 5,
      "side": "north",
      "kind": "vent"
    },
    {
      "x": 7,
      "y": 6,
      "side": "west",
      "kind": "sector"
    },
    {
      "x": 3,
      "y": 8,
      "side": "west",
      "kind": "light"
    }
  ],
  "palette_profile": "reactor",
  "vram_profile": "entity-heavy"
}
