{
  "format": "lupine-level-v2",
  "name": "Coolant Spine",
  "width": 16,
  "height": 16,
  "rows": [
    "1111111111111111",
    "1111110000100011",
    "1111110000100011",
    "1110000010000011",
    "1113110000100011",
    "1110222221111111",
    "1000022222111111",
    "1000011000011111",
    "1001030011011111",
    "1000011000011111",
    "1222221113111111",
    "1000011110100001",
    "1001000010000001",
    "1000010030100001",
    "1000011111111111",
    "1111111111111111"
  ],
  "player_spawn": {
    "x_q8": 3200,
    "y_q8": 640,
    "angle": 128,
    "safe_radius_cells": 5
  },
  "doors": [
    {
      "id": "spine_head",
      "x": 3,
      "y": 4,
      "orientation": "horizontal",
      "kind": "standard",
      "unlock": "none"
    },
    {
      "id": "pump_throat",
      "x": 5,
      "y": 8,
      "orientation": "vertical",
      "kind": "standard",
      "unlock": "none"
    },
    {
      "id": "coolant_shaft",
      "x": 9,
      "y": 10,
      "orientation": "horizontal",
      "kind": "standard",
      "unlock": "none"
    },
    {
      "id": "spine_exit",
      "x": 8,
      "y": 13,
      "orientation": "vertical",
      "kind": "exit",
      "unlock": "sentinel_dead"
    }
  ],
  "entities": [
    {
      "kind": "sentinel",
      "x_q8": 1920,
      "y_q8": 2176,
      "health": 3,
      "activation_radius_q4": 96
    },
    {
      "kind": "skirmisher",
      "x_q8": 3200,
      "y_q8": 3200,
      "health": 2,
      "activation_radius_q4": 96
    }
  ],
  "pickups": [
    {
      "kind": "medkit",
      "source": "sentinel_drop",
      "value": 25
    }
  ],
  "triggers": [
    {
      "kind": "activate_exit",
      "condition": "sentinel_dead"
    }
  ],
  "exit": {
    "x": 2,
    "y": 13,
    "marker": "beacon"
  },
  "readability": {
    "maximum_sightline": 6,
    "minimum_door_separation": 8,
    "minimum_critical_path_steps": 15,
    "minimum_critical_path_turns": 3,
    "maximum_material_singletons": 16
  },
  "fixtures": [
    {
      "x": 3,
      "y": 4,
      "side": "north",
      "kind": "access"
    },
    {
      "x": 5,
      "y": 8,
      "side": "west",
      "kind": "access"
    },
    {
      "x": 9,
      "y": 10,
      "side": "north",
      "kind": "access"
    },
    {
      "x": 8,
      "y": 13,
      "side": "west",
      "kind": "access"
    },
    {
      "x": 8,
      "y": 3,
      "side": "west",
      "kind": "sector"
    },
    {
      "x": 10,
      "y": 1,
      "side": "west",
      "kind": "light"
    },
    {
      "x": 10,
      "y": 2,
      "side": "east",
      "kind": "vent"
    },
    {
      "x": 5,
      "y": 7,
      "side": "west",
      "kind": "light"
    },
    {
      "x": 6,
      "y": 7,
      "side": "east",
      "kind": "vent"
    },
    {
      "x": 3,
      "y": 8,
      "side": "north",
      "kind": "light"
    },
    {
      "x": 9,
      "y": 8,
      "side": "east",
      "kind": "vent"
    },
    {
      "x": 5,
      "y": 11,
      "side": "west",
      "kind": "sector"
    },
    {
      "x": 10,
      "y": 11,
      "side": "east",
      "kind": "light"
    },
    {
      "x": 8,
      "y": 12,
      "side": "east",
      "kind": "vent"
    },
    {
      "x": 3,
      "y": 12,
      "side": "west",
      "kind": "light"
    },
    {
      "x": 5,
      "y": 13,
      "side": "west",
      "kind": "sector"
    }
  ],
  "palette_profile": "outpost",
  "vram_profile": "entity-heavy"
}
