{
  "format": "lupine-level-v2",
  "name": "First Steps",
  "width": 16,
  "height": 16,
  "rows": [
    "1111111111111111",
    "1111112222111111",
    "1111110000101111",
    "1111110000101111",
    "1111110000301111",
    "1111110000101111",
    "1111111011111111",
    "1111000011111111",
    "1111011111111111",
    "1100011111111111",
    "1131111111111111",
    "1000011111111111",
    "1000021111111111",
    "2000021111111111",
    "2000011111111111",
    "1111111111111111"
  ],
  "player_spawn": {"x_q8": 640, "y_q8": 3456, "angle": 192, "safe_radius_cells": 5},
  "doors": [
    {"id": "exit_door", "x": 10, "y": 4, "orientation": "vertical", "kind": "exit", "unlock": "enemies_cleared"},
    {"id": "airlock", "x": 2, "y": 10, "orientation": "horizontal", "kind": "standard", "unlock": "none"}
  ],
  "entities": [{"kind": "drone", "x_q8": 2176, "y_q8": 896, "health": 2, "activation_radius_q4": 96}],
  "pickups": [{"kind": "medkit", "source": "drop", "value": 25}],
  "exit": {"x": 11, "y": 2, "marker": "beacon"},
  "palette_profile": "training",
  "vram_profile": "entity-heavy",
  "fixtures": [
    {"x": 7, "y": 1, "side": "south", "kind": "light"},
    {"x": 0, "y": 11, "side": "east", "kind": "vent"},
    {"x": 3, "y": 7, "side": "east", "kind": "vent"},
    {"x": 10, "y": 2, "side": "east", "kind": "sector"}
  ]
}
