{
  "format": "lupine-level-v2",
  "name": "Reactor Gate",
  "width": 16,
  "height": 16,
  "rows": [
    "1111111111111111",
    "1111110000112221",
    "1222210000111111",
    "1000300100111111",
    "1000110001111111",
    "1000001000011111",
    "1000222220001111",
    "1222221110001111",
    "1111000030101111",
    "1111011110001111",
    "1111322222111111",
    "1100001000100001",
    "1100101000100001",
    "1100000010300001",
    "1100001000100001",
    "1111111111111111"
  ],
  "player_spawn": {
    "x_q8": 3200,
    "y_q8": 3712,
    "angle": 128,
    "safe_radius_cells": 5
  },
  "doors": [
    {
      "id": "cell_gate",
      "x": 10,
      "y": 13,
      "orientation": "vertical",
      "kind": "standard",
      "unlock": "none"
    },
    {
      "id": "turbine_stair",
      "x": 4,
      "y": 10,
      "orientation": "horizontal",
      "kind": "standard",
      "unlock": "none"
    },
    {
      "id": "reactor_throat",
      "x": 8,
      "y": 8,
      "orientation": "vertical",
      "kind": "standard",
      "unlock": "none"
    },
    {
      "id": "gate_lock",
      "x": 4,
      "y": 3,
      "orientation": "vertical",
      "kind": "exit",
      "unlock": "sentinel_dead"
    }
  ],
  "entities": [
    {
      "kind": "sentinel",
      "x_q8": 1920,
      "y_q8": 640,
      "health": 3,
      "activation_radius_q4": 96
    },
    {
      "kind": "skirmisher",
      "x_q8": 2688,
      "y_q8": 2432,
      "health": 2,
      "activation_radius_q4": 96
    },
    {
      "kind": "skirmisher",
      "x_q8": 1408,
      "y_q8": 3456,
      "health": 2,
      "activation_radius_q4": 96
    }
  ],
  "pickups": [
    {
      "kind": "medkit",
      "source": "sentinel_drop",
      "value": 25
    }
  ],
  "triggers": [
    {
      "kind": "activate_exit",
      "condition": "sentinel_dead"
    }
  ],
  "exit": {
    "x": 1,
    "y": 3,
    "marker": "beacon"
  },
  "readability": {
    "maximum_sightline": 6,
    "minimum_door_separation": 8,
    "minimum_critical_path_steps": 15,
    "minimum_critical_path_turns": 3,
    "maximum_material_singletons": 16
  },
  "fixtures": [
    {
      "x": 4,
      "y": 3,
      "side": "west",
      "kind": "access"
    },
    {
      "x": 8,
      "y": 8,
      "side": "east",
      "kind": "access"
    },
    {
      "x": 4,
      "y": 10,
      "side": "north",
      "kind": "access"
    },
    {
      "x": 10,
      "y": 13,
      "side": "west",
      "kind": "access"
    },
    {
      "x": 6,
      "y": 5,
      "side": "west",
      "kind": "light"
    },
    {
      "x": 8,
      "y": 6,
      "side": "east",
      "kind": "vent"
    },
    {
      "x": 4,
      "y": 4,
      "side": "west",
      "kind": "light"
    },
    {
      "x": 5,
      "y": 4,
      "side": "east",
      "kind": "vent"
    },
    {
      "x": 6,
      "y": 11,
      "side": "west",
      "kind": "light"
    },
    {
      "x": 6,
      "y": 12,
      "side": "east",
      "kind": "vent"
    },
    {
      "x": 10,
      "y": 11,
      "side": "east",
      "kind": "sector"
    },
    {
      "x": 10,
      "y": 12,
      "side": "west",
      "kind": "light"
    },
    {
      "x": 4,
      "y": 12,
      "side": "west",
      "kind": "vent"
    },
    {
      "x": 6,
      "y": 14,
      "side": "east",
      "kind": "light"
    },
    {
      "x": 10,
      "y": 14,
      "side": "west",
      "kind": "sector"
    },
    {
      "x": 8,
      "y": 13,
      "side": "west",
      "kind": "light"
    }
  ],
  "palette_profile": "outpost",
  "vram_profile": "entity-heavy"
}
