{
  "format": "lupine-level-v2",
  "name": "Signal Deck",
  "width": 16,
  "height": 16,
  "rows": [
    "1111111111111111",
    "1000011111100001",
    "1000010000100001",
    "1001030010000001",
    "1000010000100001",
    "1222221101111111",
    "1111111131111111",
    "1111111100000111",
    "1111111100000111",
    "1111111100010111",
    "1000011110000111",
    "1000011111132221",
    "1000030100000011",
    "1000010000100011",
    "1111122222100011",
    "1111111111111111"
  ],
  "player_spawn": {
    "x_q8": 640,
    "y_q8": 384,
    "angle": 64,
    "safe_radius_cells": 5
  },
  "doors": [
    {
      "id": "deck_gate",
      "x": 5,
      "y": 3,
      "orientation": "vertical",
      "kind": "standard",
      "unlock": "none"
    },
    {
      "id": "mast_shaft",
      "x": 8,
      "y": 6,
      "orientation": "horizontal",
      "kind": "standard",
      "unlock": "none"
    },
    {
      "id": "lower_throat",
      "x": 11,
      "y": 11,
      "orientation": "horizontal",
      "kind": "standard",
      "unlock": "none"
    },
    {
      "id": "deck_exit",
      "x": 5,
      "y": 12,
      "orientation": "vertical",
      "kind": "exit",
      "unlock": "sentinel_dead"
    }
  ],
  "entities": [
    {
      "kind": "sentinel",
      "x_q8": 3200,
      "y_q8": 2176,
      "health": 3,
      "activation_radius_q4": 96
    },
    {
      "kind": "skirmisher",
      "x_q8": 1920,
      "y_q8": 896,
      "health": 2,
      "activation_radius_q4": 96
    },
    {
      "kind": "skirmisher",
      "x_q8": 2944,
      "y_q8": 3200,
      "health": 2,
      "activation_radius_q4": 96
    },
    {
      "kind": "skirmisher",
      "x_q8": 2176,
      "y_q8": 3456,
      "health": 2,
      "activation_radius_q4": 96
    }
  ],
  "pickups": [
    {
      "kind": "medkit",
      "source": "sentinel_drop",
      "value": 25
    }
  ],
  "triggers": [
    {
      "kind": "activate_exit",
      "condition": "sentinel_dead"
    }
  ],
  "exit": {
    "x": 2,
    "y": 13,
    "marker": "beacon"
  },
  "readability": {
    "maximum_sightline": 6,
    "minimum_door_separation": 8,
    "minimum_critical_path_steps": 15,
    "minimum_critical_path_turns": 3,
    "maximum_material_singletons": 16
  },
  "fixtures": [
    {
      "x": 5,
      "y": 3,
      "side": "west",
      "kind": "access"
    },
    {
      "x": 8,
      "y": 6,
      "side": "north",
      "kind": "access"
    },
    {
      "x": 11,
      "y": 11,
      "side": "north",
      "kind": "access"
    },
    {
      "x": 5,
      "y": 12,
      "side": "west",
      "kind": "access"
    },
    {
      "x": 10,
      "y": 1,
      "side": "east",
      "kind": "vent"
    },
    {
      "x": 1,
      "y": 14,
      "side": "north",
      "kind": "sector"
    },
    {
      "x": 14,
      "y": 5,
      "side": "north",
      "kind": "light"
    },
    {
      "x": 2,
      "y": 14,
      "side": "north",
      "kind": "vent"
    },
    {
      "x": 9,
      "y": 1,
      "side": "south",
      "kind": "sector"
    },
    {
      "x": 3,
      "y": 14,
      "side": "north",
      "kind": "light"
    },
    {
      "x": 13,
      "y": 5,
      "side": "north",
      "kind": "vent"
    },
    {
      "x": 4,
      "y": 14,
      "side": "north",
      "kind": "sector"
    },
    {
      "x": 10,
      "y": 2,
      "side": "west",
      "kind": "light"
    },
    {
      "x": 14,
      "y": 14,
      "side": "west",
      "kind": "vent"
    },
    {
      "x": 1,
      "y": 5,
      "side": "north",
      "kind": "sector"
    },
    {
      "x": 14,
      "y": 13,
      "side": "west",
      "kind": "light"
    }
  ],
  "palette_profile": "outpost",
  "vram_profile": "entity-heavy"
}
