{
  "format": "lupine-level-v2",
  "name": "Antenna Base",
  "width": 16,
  "height": 16,
  "rows": [
    "1111111111111111",
    "1000010000100111",
    "1000010000100111",
    "1002000020100001",
    "1000011011100001",
    "1111111311110111",
    "1000110000100001",
    "1000110200102001",
    "1000000200300021",
    "1000110000111001",
    "1113111111111111",
    "1110011111100001",
    "1102000020100001",
    "1000010000302201",
    "1000010000100001",
    "1111111111111111"
  ],
  "player_spawn": {
    "x_q8": 640,
    "y_q8": 640,
    "angle": 0,
    "safe_radius_cells": 5
  },
  "doors": [
    {
      "id": "mast_stair",
      "x": 7,
      "y": 5,
      "orientation": "horizontal",
      "kind": "standard",
      "unlock": "none"
    },
    {
      "id": "base_hatch",
      "x": 3,
      "y": 10,
      "orientation": "horizontal",
      "kind": "standard",
      "unlock": "none"
    },
    {
      "id": "base_lock",
      "x": 10,
      "y": 13,
      "orientation": "vertical",
      "kind": "exit",
      "unlock": "sentinel_dead"
    },
    {
      "id": "relay_room",
      "x": 10,
      "y": 8,
      "orientation": "vertical",
      "kind": "standard",
      "unlock": "none"
    }
  ],
  "entities": [
    {
      "kind": "sentinel",
      "x_q8": 3200,
      "y_q8": 896,
      "health": 3,
      "activation_radius_q4": 96
    },
    {
      "kind": "skirmisher",
      "x_q8": 2176,
      "y_q8": 1920,
      "health": 2,
      "activation_radius_q4": 96
    },
    {
      "kind": "warden",
      "x_q8": 640,
      "y_q8": 3200,
      "health": 5,
      "activation_radius_q4": 96
    },
    {
      "kind": "sentinel",
      "x_q8": 3456,
      "y_q8": 1920,
      "health": 3,
      "activation_radius_q4": 96
    }
  ],
  "pickups": [
    {
      "kind": "medkit",
      "source": "sentinel_drop",
      "value": 25
    }
  ],
  "triggers": [
    {
      "kind": "activate_exit",
      "condition": "sentinel_dead"
    }
  ],
  "exit": {
    "x": 12,
    "y": 12,
    "marker": "beacon"
  },
  "readability": {
    "maximum_sightline": 6,
    "minimum_door_separation": 8,
    "minimum_critical_path_steps": 15,
    "minimum_critical_path_turns": 3,
    "maximum_material_singletons": 16
  },
  "fixtures": [
    {
      "x": 7,
      "y": 5,
      "side": "north",
      "kind": "access"
    },
    {
      "x": 3,
      "y": 10,
      "side": "north",
      "kind": "access"
    },
    {
      "x": 10,
      "y": 13,
      "side": "west",
      "kind": "access"
    },
    {
      "x": 10,
      "y": 8,
      "side": "west",
      "kind": "access"
    },
    {
      "x": 5,
      "y": 1,
      "side": "west",
      "kind": "light"
    },
    {
      "x": 10,
      "y": 1,
      "side": "west",
      "kind": "vent"
    },
    {
      "x": 13,
      "y": 2,
      "side": "west",
      "kind": "sector"
    },
    {
      "x": 3,
      "y": 3,
      "side": "west",
      "kind": "light"
    },
    {
      "x": 8,
      "y": 3,
      "side": "west",
      "kind": "vent"
    },
    {
      "x": 1,
      "y": 5,
      "side": "north",
      "kind": "light"
    },
    {
      "x": 6,
      "y": 5,
      "side": "south",
      "kind": "light"
    },
    {
      "x": 11,
      "y": 5,
      "side": "east",
      "kind": "vent"
    },
    {
      "x": 4,
      "y": 7,
      "side": "west",
      "kind": "sector"
    },
    {
      "x": 7,
      "y": 8,
      "side": "west",
      "kind": "light"
    }
  ],
  "palette_profile": "spire",
  "vram_profile": "entity-heavy"
}
