{
  "format": "lupine-level-v2",
  "name": "Relay Deck",
  "width": 16,
  "height": 16,
  "rows": [
    "1111111111111111",
    "1000010000100001",
    "1000000200100001",
    "1000110000302001",
    "1000110000111111",
    "1110111111111111",
    "1000011100110001",
    "1002030200110001",
    "1002010000110001",
    "1000010020000021",
    "1111111111111011",
    "1111110000100011",
    "1000010200300211",
    "1000000200100001",
    "1000010000100001",
    "1111111111111111"
  ],
  "player_spawn": {
    "x_q8": 3456,
    "y_q8": 640,
    "angle": 128,
    "safe_radius_cells": 5
  },
  "doors": [
    {
      "id": "relay_gate",
      "x": 10,
      "y": 3,
      "orientation": "vertical",
      "kind": "standard",
      "unlock": "none"
    },
    {
      "id": "deck_card",
      "x": 5,
      "y": 7,
      "orientation": "vertical",
      "kind": "standard",
      "unlock": "keycard"
    },
    {
      "id": "deck_lock",
      "x": 10,
      "y": 12,
      "orientation": "vertical",
      "kind": "exit",
      "unlock": "sentinel_dead"
    }
  ],
  "entities": [
    {
      "kind": "sentinel",
      "x_q8": 3456,
      "y_q8": 1920,
      "health": 3,
      "activation_radius_q4": 96
    },
    {
      "kind": "skirmisher",
      "x_q8": 2176,
      "y_q8": 640,
      "health": 2,
      "activation_radius_q4": 96
    },
    {
      "kind": "warden",
      "x_q8": 2176,
      "y_q8": 1920,
      "health": 5,
      "activation_radius_q4": 96
    },
    {
      "kind": "skirmisher",
      "x_q8": 3456,
      "y_q8": 3456,
      "health": 2,
      "activation_radius_q4": 96
    },
    {
      "kind": "sentinel",
      "x_q8": 640,
      "y_q8": 640,
      "health": 3,
      "activation_radius_q4": 96
    }
  ],
  "pickups": [
    {
      "kind": "medkit",
      "source": "sentinel_drop",
      "value": 25
    },
    {
      "kind": "keycard",
      "source": "sentinel_drop",
      "value": 1
    }
  ],
  "triggers": [
    {
      "kind": "activate_exit",
      "condition": "sentinel_dead"
    }
  ],
  "exit": {
    "x": 2,
    "y": 13,
    "marker": "beacon"
  },
  "readability": {
    "maximum_sightline": 6,
    "minimum_door_separation": 8,
    "minimum_critical_path_steps": 15,
    "minimum_critical_path_turns": 3,
    "maximum_material_singletons": 16
  },
  "fixtures": [
    {
      "x": 10,
      "y": 3,
      "side": "west",
      "kind": "access"
    },
    {
      "x": 5,
      "y": 7,
      "side": "west",
      "kind": "access"
    },
    {
      "x": 10,
      "y": 12,
      "side": "west",
      "kind": "access"
    },
    {
      "x": 5,
      "y": 1,
      "side": "west",
      "kind": "light"
    },
    {
      "x": 10,
      "y": 1,
      "side": "west",
      "kind": "vent"
    },
    {
      "x": 12,
      "y": 3,
      "side": "west",
      "kind": "sector"
    },
    {
      "x": 4,
      "y": 4,
      "side": "west",
      "kind": "light"
    },
    {
      "x": 1,
      "y": 5,
      "side": "north",
      "kind": "vent"
    },
    {
      "x": 7,
      "y": 5,
      "side": "north",
      "kind": "light"
    },
    {
      "x": 14,
      "y": 5,
      "side": "south",
      "kind": "light"
    },
    {
      "x": 10,
      "y": 6,
      "side": "west",
      "kind": "vent"
    },
    {
      "x": 3,
      "y": 7,
      "side": "west",
      "kind": "sector"
    },
    {
      "x": 5,
      "y": 9,
      "side": "west",
      "kind": "light"
    },
    {
      "x": 14,
      "y": 9,
      "side": "west",
      "kind": "vent"
    }
  ],
  "palette_profile": "spire",
  "vram_profile": "entity-heavy"
}
