{
  "format": "lupine-level-v2",
  "name": "Reactor Heart",
  "width": 16,
  "height": 16,
  "rows": [
    "1111111111111111",
    "1000010000100011",
    "1000000200300011",
    "1001110000100011",
    "1001110000100011",
    "1111111311111111",
    "1111110000111001",
    "1000030200111001",
    "1000010020100001",
    "1000010000100001",
    "1111010111111011",
    "1000010001100001",
    "1020012000302201",
    "1000210001111001",
    "1000010001111001",
    "1111111111111111"
  ],
  "player_spawn": {
    "x_q8": 640,
    "y_q8": 3456,
    "angle": 192,
    "safe_radius_cells": 5
  },
  "doors": [
    {
      "id": "heart_west",
      "x": 5,
      "y": 7,
      "orientation": "vertical",
      "kind": "standard",
      "unlock": "none"
    },
    {
      "id": "heart_south",
      "x": 10,
      "y": 12,
      "orientation": "vertical",
      "kind": "standard",
      "unlock": "none"
    },
    {
      "id": "heart_north",
      "x": 7,
      "y": 5,
      "orientation": "horizontal",
      "kind": "standard",
      "unlock": "none"
    },
    {
      "id": "heart_lock",
      "x": 10,
      "y": 2,
      "orientation": "vertical",
      "kind": "exit",
      "unlock": "sentinel_dead"
    }
  ],
  "entities": [
    {
      "kind": "boss",
      "x_q8": 2176,
      "y_q8": 640,
      "health": 12,
      "activation_radius_q4": 96
    },
    {
      "kind": "skirmisher",
      "x_q8": 640,
      "y_q8": 1920,
      "health": 2,
      "activation_radius_q4": 96
    },
    {
      "kind": "sentinel",
      "x_q8": 2176,
      "y_q8": 1920,
      "health": 3,
      "activation_radius_q4": 96
    },
    {
      "kind": "warden",
      "x_q8": 3456,
      "y_q8": 3456,
      "health": 5,
      "activation_radius_q4": 96
    },
    {
      "kind": "warden",
      "x_q8": 3456,
      "y_q8": 1920,
      "health": 5,
      "activation_radius_q4": 96
    }
  ],
  "pickups": [
    {
      "kind": "medkit",
      "source": "sentinel_drop",
      "value": 25
    }
  ],
  "triggers": [
    {
      "kind": "activate_exit",
      "condition": "sentinel_dead"
    }
  ],
  "exit": {
    "x": 13,
    "y": 2,
    "marker": "beacon"
  },
  "readability": {
    "maximum_sightline": 6,
    "minimum_door_separation": 8,
    "minimum_critical_path_steps": 15,
    "minimum_critical_path_turns": 3,
    "maximum_material_singletons": 16
  },
  "fixtures": [
    {
      "x": 5,
      "y": 7,
      "side": "west",
      "kind": "access"
    },
    {
      "x": 10,
      "y": 12,
      "side": "west",
      "kind": "access"
    },
    {
      "x": 7,
      "y": 5,
      "side": "north",
      "kind": "access"
    },
    {
      "x": 10,
      "y": 2,
      "side": "west",
      "kind": "access"
    },
    {
      "x": 5,
      "y": 1,
      "side": "west",
      "kind": "light"
    },
    {
      "x": 10,
      "y": 1,
      "side": "west",
      "kind": "vent"
    },
    {
      "x": 14,
      "y": 1,
      "side": "west",
      "kind": "sector"
    },
    {
      "x": 3,
      "y": 3,
      "side": "west",
      "kind": "light"
    },
    {
      "x": 1,
      "y": 5,
      "side": "north",
      "kind": "vent"
    },
    {
      "x": 6,
      "y": 5,
      "side": "north",
      "kind": "light"
    },
    {
      "x": 11,
      "y": 5,
      "side": "north",
      "kind": "light"
    },
    {
      "x": 5,
      "y": 8,
      "side": "west",
      "kind": "vent"
    },
    {
      "x": 10,
      "y": 8,
      "side": "west",
      "kind": "sector"
    },
    {
      "x": 1,
      "y": 10,
      "side": "north",
      "kind": "light"
    }
  ],
  "palette_profile": "reactor",
  "vram_profile": "entity-heavy"
}
