{
  "format": "lupine-level-v2",
  "name": "Turbine Hall",
  "width": 16,
  "height": 16,
  "rows": [
    "1111111111111111",
    "1000010011111111",
    "1020010000302001",
    "1000010000100001",
    "1000010000100001",
    "1110111111110111",
    "1100010000100001",
    "1102010000302001",
    "1120010020100001",
    "1100010000100001",
    "1131111110113111",
    "1000010000100001",
    "1000000202100001",
    "1110010000100111",
    "1110011111102111",
    "1111111111111111"
  ],
  "player_spawn": {
    "x_q8": 384,
    "y_q8": 896,
    "angle": 64,
    "safe_radius_cells": 5
  },
  "doors": [
    {
      "id": "turbine_stair",
      "x": 2,
      "y": 10,
      "orientation": "horizontal",
      "kind": "standard",
      "unlock": "none"
    },
    {
      "id": "card_gate",
      "x": 10,
      "y": 7,
      "orientation": "vertical",
      "kind": "standard",
      "unlock": "keycard"
    },
    {
      "id": "hall_lock",
      "x": 10,
      "y": 2,
      "orientation": "vertical",
      "kind": "exit",
      "unlock": "sentinel_dead"
    },
    {
      "id": "condenser",
      "x": 12,
      "y": 10,
      "orientation": "horizontal",
      "kind": "standard",
      "unlock": "none"
    }
  ],
  "entities": [
    {
      "kind": "warden",
      "x_q8": 3200,
      "y_q8": 3200,
      "health": 5,
      "activation_radius_q4": 96
    },
    {
      "kind": "skirmisher",
      "x_q8": 2176,
      "y_q8": 3456,
      "health": 2,
      "activation_radius_q4": 96
    },
    {
      "kind": "sentinel",
      "x_q8": 640,
      "y_q8": 3200,
      "health": 3,
      "activation_radius_q4": 96
    },
    {
      "kind": "sentinel",
      "x_q8": 3456,
      "y_q8": 1920,
      "health": 3,
      "activation_radius_q4": 96
    }
  ],
  "pickups": [
    {
      "kind": "medkit",
      "source": "sentinel_drop",
      "value": 25
    },
    {
      "kind": "keycard",
      "source": "sentinel_drop",
      "value": 1
    }
  ],
  "triggers": [
    {
      "kind": "activate_exit",
      "condition": "sentinel_dead"
    }
  ],
  "exit": {
    "x": 7,
    "y": 2,
    "marker": "beacon"
  },
  "readability": {
    "maximum_sightline": 6,
    "minimum_door_separation": 8,
    "minimum_critical_path_steps": 15,
    "minimum_critical_path_turns": 3,
    "maximum_material_singletons": 16
  },
  "fixtures": [
    {
      "x": 2,
      "y": 10,
      "side": "north",
      "kind": "access"
    },
    {
      "x": 10,
      "y": 7,
      "side": "west",
      "kind": "access"
    },
    {
      "x": 10,
      "y": 2,
      "side": "west",
      "kind": "access"
    },
    {
      "x": 12,
      "y": 10,
      "side": "north",
      "kind": "access"
    },
    {
      "x": 5,
      "y": 1,
      "side": "west",
      "kind": "light"
    },
    {
      "x": 9,
      "y": 1,
      "side": "south",
      "kind": "vent"
    },
    {
      "x": 13,
      "y": 1,
      "side": "south",
      "kind": "sector"
    },
    {
      "x": 2,
      "y": 2,
      "side": "west",
      "kind": "light"
    },
    {
      "x": 10,
      "y": 4,
      "side": "west",
      "kind": "vent"
    },
    {
      "x": 1,
      "y": 5,
      "side": "north",
      "kind": "light"
    },
    {
      "x": 6,
      "y": 5,
      "side": "north",
      "kind": "light"
    },
    {
      "x": 13,
      "y": 5,
      "side": "west",
      "kind": "vent"
    },
    {
      "x": 3,
      "y": 7,
      "side": "west",
      "kind": "sector"
    },
    {
      "x": 8,
      "y": 8,
      "side": "west",
      "kind": "light"
    }
  ],
  "palette_profile": "reactor",
  "vram_profile": "entity-heavy"
}
