{
  "format": "lupine-level-v2",
  "name": "Signal Vault",
  "width": 16,
  "height": 16,
  "rows": [
    "1111111111111111",
    "1000010000010001",
    "1022010000010201",
    "1000010000010001",
    "1220011131110021",
    "1000010000010001",
    "1002210000010201",
    "1000010020012001",
    "1220010000010001",
    "1000010000010001",
    "1131111131111011",
    "1000000100000011",
    "1113110001111111",
    "1000001111111111",
    "1000001111111111",
    "1111111111111111"
  ],
  "player_spawn": {
    "x_q8": 896,
    "y_q8": 3712,
    "angle": 192,
    "safe_radius_cells": 5
  },
  "doors": [
    {
      "id": "vault_lock",
      "x": 8,
      "y": 4,
      "orientation": "horizontal",
      "kind": "exit",
      "unlock": "sentinel_dead"
    },
    {
      "id": "vault_hatch",
      "x": 2,
      "y": 10,
      "orientation": "horizontal",
      "kind": "standard",
      "unlock": "none"
    },
    {
      "id": "vault_card",
      "x": 8,
      "y": 10,
      "orientation": "horizontal",
      "kind": "standard",
      "unlock": "keycard"
    },
    {
      "id": "vault_stair",
      "x": 3,
      "y": 12,
      "orientation": "horizontal",
      "kind": "standard",
      "unlock": "none"
    }
  ],
  "entities": [
    {
      "kind": "sentinel",
      "x_q8": 3200,
      "y_q8": 384,
      "health": 3,
      "activation_radius_q4": 96
    },
    {
      "kind": "skirmisher",
      "x_q8": 384,
      "y_q8": 1408,
      "health": 2,
      "activation_radius_q4": 96
    },
    {
      "kind": "warden",
      "x_q8": 1920,
      "y_q8": 1664,
      "health": 5,
      "activation_radius_q4": 96
    },
    {
      "kind": "warden",
      "x_q8": 2432,
      "y_q8": 2176,
      "health": 5,
      "activation_radius_q4": 96
    },
    {
      "kind": "sentinel",
      "x_q8": 1152,
      "y_q8": 2432,
      "health": 3,
      "activation_radius_q4": 96
    }
  ],
  "pickups": [
    {
      "kind": "medkit",
      "source": "sentinel_drop",
      "value": 25
    },
    {
      "kind": "keycard",
      "source": "sentinel_drop",
      "value": 1
    }
  ],
  "triggers": [
    {
      "kind": "activate_exit",
      "condition": "sentinel_dead"
    }
  ],
  "exit": {
    "x": 8,
    "y": 2,
    "marker": "beacon"
  },
  "readability": {
    "maximum_sightline": 6,
    "minimum_door_separation": 8,
    "minimum_critical_path_steps": 12,
    "minimum_critical_path_turns": 3,
    "maximum_material_singletons": 16
  },
  "fixtures": [
    {
      "x": 8,
      "y": 4,
      "side": "north",
      "kind": "access"
    },
    {
      "x": 2,
      "y": 10,
      "side": "north",
      "kind": "access"
    },
    {
      "x": 8,
      "y": 10,
      "side": "north",
      "kind": "access"
    },
    {
      "x": 3,
      "y": 12,
      "side": "north",
      "kind": "access"
    },
    {
      "x": 5,
      "y": 1,
      "side": "west",
      "kind": "light"
    },
    {
      "x": 11,
      "y": 1,
      "side": "west",
      "kind": "vent"
    },
    {
      "x": 2,
      "y": 2,
      "side": "west",
      "kind": "sector"
    },
    {
      "x": 6,
      "y": 4,
      "side": "north",
      "kind": "light"
    },
    {
      "x": 10,
      "y": 4,
      "side": "north",
      "kind": "vent"
    },
    {
      "x": 14,
      "y": 4,
      "side": "west",
      "kind": "light"
    },
    {
      "x": 3,
      "y": 6,
      "side": "west",
      "kind": "light"
    },
    {
      "x": 8,
      "y": 7,
      "side": "west",
      "kind": "vent"
    },
    {
      "x": 12,
      "y": 7,
      "side": "east",
      "kind": "sector"
    },
    {
      "x": 1,
      "y": 8,
      "side": "north",
      "kind": "light"
    }
  ],
  "palette_profile": "spire",
  "vram_profile": "entity-heavy"
}
