{
  "format": "lupine-level-v2",
  "name": "Transmitter Ring",
  "width": 16,
  "height": 16,
  "rows": [
    "1111111111111111",
    "1000010000110001",
    "1020010200000021",
    "1000011100110001",
    "1000011100110001",
    "1131111111111011",
    "1000010000111001",
    "1000010000302201",
    "1002030020100001",
    "1111110000100001",
    "1111111131111111",
    "1001110001100001",
    "1000000201102001",
    "1000010000002001",
    "1000010001100001",
    "1111111111111111"
  ],
  "player_spawn": {
    "x_q8": 1920,
    "y_q8": 2176,
    "angle": 192,
    "safe_radius_cells": 5
  },
  "doors": [
    {
      "id": "ring_south",
      "x": 8,
      "y": 10,
      "orientation": "horizontal",
      "kind": "standard",
      "unlock": "none"
    },
    {
      "id": "ring_east",
      "x": 10,
      "y": 7,
      "orientation": "vertical",
      "kind": "standard",
      "unlock": "none"
    },
    {
      "id": "ring_west",
      "x": 5,
      "y": 8,
      "orientation": "vertical",
      "kind": "standard",
      "unlock": "none"
    },
    {
      "id": "ring_lock",
      "x": 2,
      "y": 5,
      "orientation": "horizontal",
      "kind": "exit",
      "unlock": "sentinel_dead"
    }
  ],
  "entities": [
    {
      "kind": "sentinel",
      "x_q8": 3456,
      "y_q8": 640,
      "health": 3,
      "activation_radius_q4": 96
    },
    {
      "kind": "skirmisher",
      "x_q8": 640,
      "y_q8": 3200,
      "health": 2,
      "activation_radius_q4": 96
    },
    {
      "kind": "warden",
      "x_q8": 3456,
      "y_q8": 3456,
      "health": 5,
      "activation_radius_q4": 96
    },
    {
      "kind": "sentinel",
      "x_q8": 2176,
      "y_q8": 640,
      "health": 3,
      "activation_radius_q4": 96
    },
    {
      "kind": "skirmisher",
      "x_q8": 640,
      "y_q8": 1920,
      "health": 2,
      "activation_radius_q4": 96
    }
  ],
  "pickups": [
    {
      "kind": "medkit",
      "source": "sentinel_drop",
      "value": 25
    }
  ],
  "triggers": [
    {
      "kind": "activate_exit",
      "condition": "sentinel_dead"
    }
  ],
  "exit": {
    "x": 3,
    "y": 3,
    "marker": "beacon"
  },
  "readability": {
    "maximum_sightline": 6,
    "minimum_door_separation": 8,
    "minimum_critical_path_steps": 15,
    "minimum_critical_path_turns": 3,
    "maximum_material_singletons": 16
  },
  "fixtures": [
    {
      "x": 8,
      "y": 10,
      "side": "north",
      "kind": "access"
    },
    {
      "x": 10,
      "y": 7,
      "side": "west",
      "kind": "access"
    },
    {
      "x": 5,
      "y": 8,
      "side": "west",
      "kind": "access"
    },
    {
      "x": 2,
      "y": 5,
      "side": "north",
      "kind": "access"
    },
    {
      "x": 5,
      "y": 1,
      "side": "west",
      "kind": "light"
    },
    {
      "x": 10,
      "y": 1,
      "side": "west",
      "kind": "vent"
    },
    {
      "x": 2,
      "y": 2,
      "side": "west",
      "kind": "sector"
    },
    {
      "x": 14,
      "y": 2,
      "side": "west",
      "kind": "light"
    },
    {
      "x": 7,
      "y": 3,
      "side": "east",
      "kind": "vent"
    },
    {
      "x": 11,
      "y": 4,
      "side": "east",
      "kind": "light"
    },
    {
      "x": 1,
      "y": 5,
      "side": "north",
      "kind": "light"
    },
    {
      "x": 5,
      "y": 6,
      "side": "west",
      "kind": "vent"
    },
    {
      "x": 12,
      "y": 7,
      "side": "west",
      "kind": "sector"
    },
    {
      "x": 3,
      "y": 8,
      "side": "west",
      "kind": "light"
    }
  ],
  "palette_profile": "spire",
  "vram_profile": "entity-heavy"
}
