{
  "format": "lupine-level-v2",
  "name": "Signal Deck",
  "width": 16,
  "height": 16,
  "rows": [
    "1111111111111111",
    "1111100001111111",
    "1111100001111111",
    "1111111311111111",
    "1111100000011111",
    "1000102222010001",
    "1000302222030001",
    "1000102222010001",
    "1000102222010001",
    "1111100000011111",
    "1111111311111111",
    "1111100000111111",
    "1000102020111111",
    "1000302000111111",
    "1000100000111111",
    "1111111111111111"
  ],
  "player_spawn": {
    "x_q8": 3456,
    "y_q8": 1920,
    "angle": 128,
    "safe_radius_cells": 5
  },
  "doors": [
    {
      "id": "mast_shaft",
      "x": 7,
      "y": 3,
      "orientation": "horizontal",
      "kind": "standard",
      "unlock": "none"
    },
    {
      "id": "radio_room",
      "x": 4,
      "y": 6,
      "orientation": "vertical",
      "kind": "standard",
      "unlock": "none"
    },
    {
      "id": "deck_gate",
      "x": 11,
      "y": 6,
      "orientation": "vertical",
      "kind": "standard",
      "unlock": "none"
    },
    {
      "id": "lower_throat",
      "x": 7,
      "y": 10,
      "orientation": "horizontal",
      "kind": "standard",
      "unlock": "keycard"
    },
    {
      "id": "exit_lift",
      "x": 4,
      "y": 13,
      "orientation": "vertical",
      "kind": "exit",
      "unlock": "sentinel_dead"
    }
  ],
  "entities": [
    {
      "kind": "skirmisher",
      "x_q8": 1408,
      "y_q8": 384,
      "health": 2,
      "activation_radius_q4": 96
    },
    {
      "kind": "skirmisher",
      "x_q8": 640,
      "y_q8": 1664,
      "health": 2,
      "activation_radius_q4": 96
    },
    {
      "kind": "skirmisher",
      "x_q8": 2176,
      "y_q8": 2432,
      "health": 2,
      "activation_radius_q4": 96
    },
    {
      "kind": "warden",
      "x_q8": 1920,
      "y_q8": 3712,
      "health": 5,
      "activation_radius_q4": 96
    }
  ],
  "pickups": [
    {
      "kind": "medkit",
      "source": "sentinel_drop",
      "value": 25
    },
    {
      "kind": "keycard",
      "source": "sentinel_drop",
      "value": 1
    }
  ],
  "triggers": [
    {
      "kind": "activate_exit",
      "condition": "sentinel_dead"
    }
  ],
  "exit": {
    "x": 2,
    "y": 13,
    "marker": "beacon"
  },
  "readability": {
    "maximum_sightline": 6,
    "minimum_door_separation": 8,
    "minimum_critical_path_steps": 12,
    "minimum_critical_path_turns": 3,
    "maximum_material_singletons": 16
  },
  "fixtures": [
    {
      "x": 7,
      "y": 3,
      "side": "north",
      "kind": "access"
    },
    {
      "x": 4,
      "y": 6,
      "side": "west",
      "kind": "access"
    },
    {
      "x": 11,
      "y": 6,
      "side": "west",
      "kind": "access"
    },
    {
      "x": 7,
      "y": 10,
      "side": "north",
      "kind": "access"
    },
    {
      "x": 4,
      "y": 13,
      "side": "west",
      "kind": "access"
    },
    {
      "x": 4,
      "y": 1,
      "side": "east",
      "kind": "light"
    },
    {
      "x": 9,
      "y": 1,
      "side": "west",
      "kind": "vent"
    },
    {
      "x": 6,
      "y": 3,
      "side": "north",
      "kind": "sector"
    },
    {
      "x": 1,
      "y": 4,
      "side": "south",
      "kind": "light"
    },
    {
      "x": 11,
      "y": 4,
      "side": "west",
      "kind": "vent"
    },
    {
      "x": 4,
      "y": 5,
      "side": "west",
      "kind": "light"
    },
    {
      "x": 8,
      "y": 5,
      "side": "north",
      "kind": "light"
    },
    {
      "x": 6,
      "y": 7,
      "side": "west",
      "kind": "vent"
    },
    {
      "x": 9,
      "y": 8,
      "side": "east",
      "kind": "sector"
    }
  ],
  "palette_profile": "outpost",
  "vram_profile": "entity-heavy"
}
